{
	"$schema": "https://json-schema.org/draft/2020-12/schema",
	"$id": "https://uwscope.org/schemas/documents/values-inventory",
	"title": "IValuesInventory",
	"description": "IValuesInventory Type",
	"type": "object",
	"properties": {
		"_id": {
			"type": "string"
		},
		"_type": {
			"const": "valuesInventory"
		},
		"_rev": {
			"type": "number"
		},
		"assigned": {
			"type": "boolean"
		},
		"assignedDateTime": {
			"$ref": "/schemas/utils/datetime#/properties/datetime"
		},
		"lastUpdatedDateTime": {
			"$ref": "/schemas/utils/datetime#/properties/datetime"
		},
		"values": {
			"type": "array",
			"items": {
				"$ref": "/schemas/documents/utils/life-area-value"
			}
		}
	},
	"additionalProperties": false,
	"required": ["_type", "assigned", "assignedDateTime"]
}
