{
    "_type": "valuesInventory",
    "_rev": 1,
    "assigned": true,
    "assignedDateTime": "2012-12-12T12:12:12Z",
    "values": [
        {
            "name": "name",
            "createdDateTime": "2012-12-12T12:12:12Z",
            "editedDateTime": "2012-12-12T12:12:12Z",
            "lifeareaId": "",
            "activities": [
                {
                    "name": "name",
                    "createdDateTime": "2012-12-12T12:12:12Z",
                    "editedDateTime": "2012-12-12T12:12:12Z",
                    "enjoyment": 5,
                    "importance": 5
                }
            ]
        }
    ]
}
